{
  "$schema": "https://json-schema.org/draft/2020-12/schema",
  "$id": "https://example.com/schemas/mission_schema.json",
  "title": "Multi-Agent Drone Mission",
  "description": "Contract for LLM-generated multi-drone formation mission plans. The LLM's only job is to produce JSON matching this schema exactly (no prose, no commands). A deterministic executor reads the validated JSON and drives the simulation -- the LLM is never in that loop.",
  "type": "object",
  "additionalProperties": false,
  "required": [
    "mission_id",
    "operator_prompt",
    "num_agents",
    "formation",
    "task",
    "altitude_m",
    "speed_mps",
    "loop_count",
    "safety"
  ],
  "properties": {
    "mission_id": {
      "type": "string",
      "minLength": 1,
      "description": "Unique identifier for this mission plan (e.g. a short slug or UUID). Used for logging/traceability."
    },
    "operator_prompt": {
      "type": "string",
      "minLength": 1,
      "description": "The original natural-language operator command this plan was generated from. Echoed back for audit purposes."
    },
    "num_agents": {
      "type": "integer",
      "minimum": 2,
      "maximum": 3,
      "description": "Number of drones participating in the mission. This challenge scopes to 2-3 drones."
    },
    "formation": {
      "type": "object",
      "additionalProperties": false,
      "required": ["type", "spacing_m"],
      "properties": {
        "type": {
          "type": "string",
          "enum": ["wedge", "line", "column", "split"],
          "description": "Coordination geometry. 'wedge'/'line'/'column' hold a fixed geometric shape relative to a virtual leader. 'split' divides the task's waypoints/area evenly across agents instead of holding a shape, and requires task.regroup_point."
        },
        "spacing_m": {
          "type": "number",
          "exclusiveMinimum": 0,
          "maximum": 50,
          "description": "Nominal distance in meters between adjacent drones in the formation. Must be >= safety.min_separation_m (checked outside the schema)."
        }
      }
    },
    "task": {
      "description": "Discriminated union on task.type. 'area_sweep' requires area_of_interest; 'patrol_route' requires route. regroup_point is always present but nullable at the schema level (null unless formation.type == 'split'); the validator enforces that it is non-null when formation.type == 'split'. It is kept required-but-nullable, rather than optional, so the schema stays compatible with strict structured-output enforcement, which does not reliably support optional properties.",
      "anyOf": [
        {
          "type": "object",
          "additionalProperties": false,
          "required": ["type", "area_of_interest", "regroup_point"],
          "properties": {
            "type": { "const": "area_sweep" },
            "area_of_interest": {
              "type": "array",
              "minItems": 3,
              "items": { "$ref": "#/$defs/point2d" },
              "description": "Polygon vertices (meters, local XY frame, order matters) bounding the area to sweep."
            },
            "regroup_point": {
              "anyOf": [{ "$ref": "#/$defs/point2d" }, { "type": "null" }],
              "description": "Point (meters, local XY frame) where all drones rendezvous after completing their assigned segment. Must be non-null when formation.type == 'split', null otherwise."
            }
          }
        },
        {
          "type": "object",
          "additionalProperties": false,
          "required": ["type", "route", "regroup_point"],
          "properties": {
            "type": { "const": "patrol_route" },
            "route": {
              "type": "array",
              "minItems": 2,
              "items": { "$ref": "#/$defs/point2d" },
              "description": "Ordered waypoints (meters, local XY frame) defining the patrol route."
            },
            "regroup_point": {
              "anyOf": [{ "$ref": "#/$defs/point2d" }, { "type": "null" }],
              "description": "Point (meters, local XY frame) where all drones rendezvous after completing their assigned segment. Must be non-null when formation.type == 'split', null otherwise."
            }
          }
        }
      ]
    },
    "altitude_m": {
      "type": "number",
      "exclusiveMinimum": 0,
      "description": "Nominal cruise altitude in meters. Must be <= safety.max_altitude_m (checked outside the schema)."
    },
    "speed_mps": {
      "type": "number",
      "exclusiveMinimum": 0,
      "description": "Nominal cruise speed in meters/second. Must be <= safety.max_speed_mps (checked outside the schema)."
    },
    "loop_count": {
      "type": "integer",
      "minimum": 1,
      "maximum": 10,
      "description": "Number of times to repeat the route/sweep. 1 = single pass, no looping."
    },
    "safety": {
      "type": "object",
      "additionalProperties": false,
      "required": ["max_altitude_m", "max_speed_mps", "min_separation_m", "geofence"],
      "properties": {
        "max_altitude_m": {
          "type": "number",
          "exclusiveMinimum": 0,
          "description": "Hard ceiling on altitude_m for this mission."
        },
        "max_speed_mps": {
          "type": "number",
          "exclusiveMinimum": 0,
          "description": "Hard ceiling on speed_mps for this mission."
        },
        "min_separation_m": {
          "type": "number",
          "exclusiveMinimum": 0,
          "description": "Minimum allowed horizontal distance between any two drones at any point during execution."
        },
        "geofence": {
          "type": "object",
          "additionalProperties": false,
          "required": ["min_x", "max_x", "min_y", "max_y"],
          "properties": {
            "min_x": { "type": "number" },
            "max_x": { "type": "number" },
            "min_y": { "type": "number" },
            "max_y": { "type": "number" }
          },
          "description": "Axis-aligned bounding box (meters, local XY frame) that all waypoints, the area of interest, and the regroup point must fall within."
        }
      }
    }
  },
  "$defs": {
    "point2d": {
      "type": "object",
      "additionalProperties": false,
      "required": ["x", "y"],
      "properties": {
        "x": { "type": "number" },
        "y": { "type": "number" }
      }
    }
  }
}
