{
  "mission_id": "split-patrol-perimeter-01",
  "operator_prompt": "Split this patrol route between the two of you and regroup at the end",
  "num_agents": 2,
  "formation": {
    "type": "split",
    "spacing_m": 5
  },
  "task": {
    "type": "patrol_route",
    "route": [
      { "x": 0, "y": 0 },
      { "x": 80, "y": 0 },
      { "x": 80, "y": 40 },
      { "x": 0, "y": 40 }
    ],
    "regroup_point": { "x": 0, "y": 0 }
  },
  "altitude_m": 12,
  "speed_mps": 5,
  "loop_count": 1,
  "safety": {
    "max_altitude_m": 30,
    "max_speed_mps": 10,
    "min_separation_m": 2,
    "geofence": { "min_x": -10, "max_x": 100, "min_y": -10, "max_y": 60 }
  }
}
